<?xml version="1.0" encoding="UTF-8"?>

<table 
	xmlns:xsi="http://www.w3.org/2001/XMLSchema-instance"
xsi:noNamespaceSchemaLocation="xml-schema.xsd">
	<student name="Иванов">
		<mark discipline="Мультимедиа">3</mark>
		<mark discipline="Веб-дизайн">3</mark>
		<mark discipline="Графика">5</mark>
	</student>
	<student name="Петрова">
		<mark discipline="Мультимедиа">3</mark>
		<mark discipline="Веб-дизайн">4</mark>
		<mark discipline="Графика">5</mark>
		<mark discipline="Логина">5</mark>
	</student>
	<student name="Сидоренко">
		<mark discipline="Мультимедиа">3</mark>
		<mark discipline="Веб-дизайн">3</mark>
		<mark discipline="Графика">5</mark>
		<mark discipline="Логина">4</mark>
	</student>
</table>